{
  "ruleId": "ELEMENT_SUPPORT",
  "source": "SAJU",
  "subject": "PAIR",
  "category": "SUPPORT",
  "period": {
    "type": "LIFETIME"
  },
  "metadata": {
    "ruleVariant": "GENERATION"
  },
  "direction": "POSITIVE",
  "signedValue": 0.7,
  "featureId": "ft_bed0c9a46847b36729ffc03ecdbca23608fc3642d329327a",
  "rawValue": null,
  "baseWeight": 0.85,
  "confidence": 1
}
